[
  {
    "acc": "P9WMI9",
    "ion": "Cd2+",
    "ion_source": "binding_site",
    "ion_detail": "Cd(2+)",
    "name": "HTH-type transcriptional regulator CmtR",
    "organism": "Mycobacterium tuberculosis (strain ATCC 25618 / H37Rv)",
    "pdb": [
      "2JSC"
    ],
    "pubmed": [],
    "seq": "MLTCEMRESALARLGRALADPTRCRILVALLDGVCYPGQLAAHLGLTRSNVSNHLSCLRGCGLVVATYEGRQVRYALADSHLARALGELVQVVLAVDTDQPCVAERAASGEAVEMTGS",
    "cluster": "ArsR_c6",
    "assign_method": "membership",
    "support": 1.0,
    "identity": 1.0
  },
  {
    "acc": "O69711",
    "ion": "Ni2+",
    "ion_source": "binding_site",
    "ion_detail": "Ni(2+)",
    "name": "HTH-type transcriptional regulator NmtR",
    "organism": "Mycobacterium tuberculosis (strain ATCC 25618 / H37Rv)",
    "pdb": [],
    "pubmed": [],
    "seq": "MGHGVEGRNRPSAPLDSQAAAQVASTLQALATPSRLMILTQLRNGPLPVTDLAEAIGMEQSAVSHQLRVLRNLGLVVGDRAGRSIVYSLYDTHVAQLLDEAIYHSEHLHLGLSDRHPSAG",
    "cluster": "ArsR_c2",
    "assign_method": "membership",
    "support": 1.0,
    "identity": 1.0
  },
  {
    "acc": "P77295",
    "ion": null,
    "ion_source": null,
    "ion_detail": null,
    "name": "HTH-type transcriptional regulator YgaV",
    "organism": "Escherichia coli (strain K12)",
    "pdb": [
      "3CUO"
    ],
    "pubmed": [],
    "seq": "MTELAQLQASAEQAAALLKAMSHPKRLLILCMLSGSPGTSAGELTRITGLSASATSQHLARMRDEGLIDSQRDAQRILYSIKNEAVNAIIATLKNVYCP",
    "cluster": "ArsR_c7",
    "assign_method": "membership",
    "support": 1.0,
    "identity": 1.0
  },
  {
    "acc": "O53838",
    "ion": null,
    "ion_source": null,
    "ion_detail": null,
    "name": "HTH-type transcriptional regulator KmtR",
    "organism": "Mycobacterium tuberculosis (strain ATCC 25618 / H37Rv)",
    "pdb": [],
    "pubmed": [],
    "seq": "MYADSGPDPLPDDQVCLVVEVFRMLADATRVQVLWSLADREMSVNELAEQVGKPAPSVSQHLAKLRMARLVRTRRDGTTIFYRLENEHVRQLVIDAVFNAEHAGPGIPRHHRAAGGLQSVAKASATKDVG",
    "cluster": "ArsR_c2",
    "assign_method": "membership",
    "support": 1.0,
    "identity": 1.0
  },
  {
    "acc": "O53478",
    "ion": null,
    "ion_source": null,
    "ion_detail": null,
    "name": "HTH-type transcriptional regulator Rv2034",
    "organism": "Mycobacterium tuberculosis (strain ATCC 25618 / H37Rv)",
    "pdb": [],
    "pubmed": [],
    "seq": "MSTYRSPDRAWQALADGTRRAIVERLAHGPLAVGELARDLPVSRPAVSQHLKVLKTARLVCDRPAGTRRVYQLDPTGLAALRTDLDRFWTRALTGYAQLIDSEGDDT",
    "cluster": "ArsR_c9",
    "assign_method": "sequence",
    "support": 0.985,
    "identity": 0.699
  },
  {
    "acc": "P20047",
    "ion": "Cd2+",
    "ion_source": "binding_site",
    "ion_detail": "Cd(2+)",
    "name": "Cadmium resistance transcriptional regulatory protein CadC",
    "organism": "Staphylococcus aureus",
    "pdb": [
      "1U2W",
      "3F72"
    ],
    "pubmed": [],
    "seq": "MKKKDTCEIFCYDEEKVNRIQGDLQTVDISGVSQILKAIADENRAKITYALCQDEELCVCDIANILGVTIANASHHLRTLYKQGVVNFRKEGKLALYSLGDEHIRQIMMIALAHKKEVKVNV",
    "cluster": "ArsR_c2",
    "assign_method": "membership",
    "support": 1.0,
    "identity": 1.0
  },
  {
    "acc": "P30340",
    "ion": "Zn2+",
    "ion_source": "binding_site",
    "ion_detail": "Zn(2+)",
    "name": "Transcriptional repressor SmtB",
    "organism": "Synechococcus elongatus (strain ATCC 33912 / PCC 7942 / FACHB-805)",
    "pdb": [
      "1R1T",
      "1R22",
      "1R23",
      "1SMT"
    ],
    "pubmed": [],
    "seq": "MTKPVLQDGETVVCQGTHAAIASELQAIAPEVAQSLAEFFAVLADPNRLRLLSLLARSELCVGDLAQAIGVSESAVSHQLRSLRNLRLVSYRKQGRHVYYQLQDHHIVALYQNALDHLQECR",
    "cluster": "ArsR_c2",
    "assign_method": "membership",
    "support": 1.0,
    "identity": 1.0
  },
  {
    "acc": "P9WMI5",
    "ion": "Zn2+",
    "ion_source": "binding_site",
    "ion_detail": "Zn(2+)",
    "name": "HTH-type transcriptional repressor SmtB",
    "organism": "Mycobacterium tuberculosis (strain ATCC 25618 / H37Rv)",
    "pdb": [
      "8QKF"
    ],
    "pubmed": [],
    "seq": "MVTSPSTPTAAHEDVGADEVGGHQHPADRFAECPTFPAPPPREILDAAGELLRALAAPVRIAIVLQLRESQRCVHELVDALHVPQPLVSQHLKILKAAGVVTGERSGREVLYRLADHHLAHIVLDAVAHAGEDAI",
    "cluster": "ArsR_c5",
    "assign_method": "membership",
    "support": 1.0,
    "identity": 1.0
  },
  {
    "acc": "P96677",
    "ion": "As3+",
    "ion_source": "binding_site",
    "ion_detail": "arsenite",
    "name": "HTH-type transcriptional repressor AseR",
    "organism": "Bacillus subtilis (strain 168)",
    "pdb": [],
    "pubmed": [],
    "seq": "MTIDVAAMTRCLKTLSDQTRLIMMRLFLEQEYCVCQLVDMFEMSQPAISQHLRKLKNAGFVNEDRRGQWRYYSINGSCPEFDTLQLILHQIDQEDELLNHIKQKKTQACCQ",
    "cluster": "ArsR_c1",
    "assign_method": "membership",
    "support": 1.0,
    "identity": 1.0
  },
  {
    "acc": "O31844",
    "ion": "Zn2+",
    "ion_source": "binding_site",
    "ion_detail": "Zn(2+)",
    "name": "HTH-type transcriptional repressor CzrA",
    "organism": "Bacillus subtilis (strain 168)",
    "pdb": [],
    "pubmed": [],
    "seq": "MTEFRETEQSAADLDEETLFLVAQTFKALSDPTRIRILHLLSQGEHAVNGIAEKLNLLQSTVSHQLRFLKNLRLVKSRREGTSIYYSPEDEHVLDVLQQMIHHTQHD",
    "cluster": "ArsR_c2",
    "assign_method": "membership",
    "support": 1.0,
    "identity": 1.0
  },
  {
    "acc": "O32242",
    "ion": null,
    "ion_source": null,
    "ion_detail": null,
    "name": "Transcriptional repressor SdpR",
    "organism": "Bacillus subtilis (strain 168)",
    "pdb": [],
    "pubmed": [],
    "seq": "MNNVFKAISDPTRRKILDLLKGGDMTAGDIAEHFNISKPSISHHLNILKQAEVISDHRKGQFIYYSLNTTVLQDSINWMLNFINKGDNDL",
    "cluster": "ArsR_c9",
    "assign_method": "membership",
    "support": 1.0,
    "identity": 1.0
  },
  {
    "acc": "P37309",
    "ion": "As3+",
    "ion_source": "protein_name",
    "ion_detail": "Arsenical resistance operon repressor",
    "name": "Arsenical resistance operon repressor",
    "organism": "Escherichia coli (strain K12)",
    "pdb": [],
    "pubmed": [],
    "seq": "MSFLLPIQLFKILADETRLGIVLLLSELGELCVCDLCTALDQSQPKISRHLALLRESGLLLDRKQGKWVHYRLSPHIPAWAAKIIDEAWRCEQEKVQAIVRNLARQNCSGDSKNICS",
    "cluster": "ArsR_c1",
    "assign_method": "membership",
    "support": 1.0,
    "identity": 1.0
  },
  {
    "acc": "Q8UAA8",
    "ion": null,
    "ion_source": null,
    "ion_detail": null,
    "name": "Biofilm growth-associated repressor",
    "organism": "Agrobacterium fabrum (strain C58 / ATCC 33970)",
    "pdb": [],
    "pubmed": [],
    "seq": "MVTETPLEKPLDIGEIPLPAMEKRATEVAILLKTLAHPARLMLACTLAQGEFSVGELEAKLDIRQPTLSQQLGVLREAGIVDTRREAKQIFYRLAEDKAARLIEALYAIFCAPEENL",
    "cluster": "ArsR_c7",
    "assign_method": "sequence",
    "support": 1.0,
    "identity": 0.812
  },
  {
    "acc": "O08446",
    "ion": null,
    "ion_source": null,
    "ion_detail": null,
    "name": "HTH-type transcriptional regulator Rv0324",
    "organism": "Mycobacterium tuberculosis (strain ATCC 25618 / H37Rv)",
    "pdb": [],
    "pubmed": [],
    "seq": "MAGQSDRKAALLDQVARVGKALANGRRLQILDLLAQGERAVEAIATATGMNLTTASANLQALKSGGLVEARREGTRQYYRIAGEDVARLFALVQVVADEHLADVAVAAADVLGSPEDAITRAELLRRREAGEVTLVDVRPHEEYQAGHIPGAINIPIAELADRLAELTGDRDIVAYCRGAYCVMAPDAVRIARDAGREVKRLDDGMLEWRLAGLPVDEGAPVGHGD",
    "cluster": "ArsR_c7",
    "assign_method": "sequence",
    "support": 0.643,
    "identity": 0.5
  },
  {
    "acc": "P15905",
    "ion": "As3+",
    "ion_source": "protein_name",
    "ion_detail": "Arsenical resistance operon repressor",
    "name": "Arsenical resistance operon repressor",
    "organism": "Escherichia coli",
    "pdb": [],
    "pubmed": [],
    "seq": "MLQLTPLQLFKNLSDETRLGIVLLLREMGELCVCDLCMALDQSQPKISRHLAMLRESGILLDRKQGKWVHYRLSPHIPSWAAQIIEQAWLSQQDDVQVIARKLASVNCSGSSKAVCI",
    "cluster": "ArsR_c1",
    "assign_method": "membership",
    "support": 1.0,
    "identity": 1.0
  },
  {
    "acc": "P28267",
    "ion": null,
    "ion_source": null,
    "ion_detail": null,
    "name": "Nodulation protein NolR",
    "organism": "Rhizobium meliloti",
    "pdb": [],
    "pubmed": [],
    "seq": "MNFRMEHTMQPLPPEKHEDAEIAAGFLSAMANPKRLLILDSLVKEEMAVGALAHKVGLSQSALSQHLSKLRAQNLVSTRRDAQTIYYSSSSDAVLKILGALSDIYGDDTDAVEEKPLVRKSA",
    "cluster": "ArsR_c7",
    "assign_method": "membership",
    "support": 1.0,
    "identity": 1.0
  },
  {
    "acc": "Q88LK1",
    "ion": "As3+",
    "ion_source": "binding_site",
    "ion_detail": "arsenite",
    "name": "Arsenic resistance transcriptional regulator ArsR1",
    "organism": "Pseudomonas putida (strain ATCC 47054 / DSM 6125 / CFBP 8728 / NCIMB 11950 / KT2440)",
    "pdb": [],
    "pubmed": [],
    "seq": "MAVRAFPGGHMREILTPPIVFKCLADDTRARMTLLIAREGELCVCELTHALELSQPKISRHLAQLREAGILMDRRKGQWVYYRLHPEVPQWVDAMLKGVVDANQEWLSPDALRLAEMGERPQSPVACA",
    "cluster": "ArsR_c1",
    "assign_method": "membership",
    "support": 1.0,
    "identity": 1.0
  },
  {
    "acc": "Q9PFB1",
    "ion": null,
    "ion_source": null,
    "ion_detail": null,
    "name": "Biofilm growth-associated repressor",
    "organism": "Xylella fastidiosa (strain 9a5c)",
    "pdb": [
      "3PQJ",
      "3PQK"
    ],
    "pubmed": [],
    "seq": "MVNEMRDDTRPHMTREDMEKRANEVANLLKTLSHPVRLMLVCTLVEGEFSVGELEQQIGIGQPTLSQQLGVLRESGIVETRRNIKQIFYRLTEAKAAQLVNALYTIFCAQEKQA",
    "cluster": "ArsR_c7",
    "assign_method": "membership",
    "support": 1.0,
    "identity": 1.0
  },
  {
    "acc": "Q55940",
    "ion": "Zn2+",
    "ion_source": "binding_site",
    "ion_detail": "Zn(2+)",
    "name": "Transcriptional repressor SmtB homolog",
    "organism": "Synechocystis sp. (strain ATCC 27184 / PCC 6803 / Kazusa)",
    "pdb": [],
    "pubmed": [],
    "seq": "MSKSSLSKSQSCQNEEMPLCDQPLVHLEQVRQVQPEVMSLDQAQQMAEFFSALADPSRLRLMSALARQELCVCDLAAAMKVSESAVSHQLRILRSQRLVKYRRVGRNVYYSLADNHVMNLYREVADHLQESD",
    "cluster": "ArsR_c2",
    "assign_method": "membership",
    "support": 1.0,
    "identity": 1.0
  },
  {
    "acc": "P52144",
    "ion": "As3+",
    "ion_source": "protein_name",
    "ion_detail": "Arsenical resistance operon repressor",
    "name": "Arsenical resistance operon repressor",
    "organism": "Escherichia coli",
    "pdb": [],
    "pubmed": [],